{
  "description": "Biome for formatting and linting, set up as VS Code formatter (expects an .editorconfig)",
  "mode": "inject",
  "npm": {
    "devDependencies": {
      "@biomejs/biome": "2.6.4"
    }
  },
  "patches": [
    {
      "file": ".vscode/extensions.json",
      "merge": { "recommendations": ["biomejs.biome", "editorconfig.editorconfig"] }
    },
    {
      "file": ".vscode/settings.json",
      "merge": {
        "editor.defaultFormatter": "biomejs.biome",
        "editor.formatOnSave": true,
        "editor.formatOnPaste": true,
        "[javascript]": { "editor.defaultFormatter": "biomejs.biome" },
        "[javascriptreact]": { "editor.defaultFormatter": "biomejs.biome" },
        "[typescript]": { "editor.defaultFormatter": "biomejs.biome" },
        "[typescriptreact]": { "editor.defaultFormatter": "biomejs.biome" },
        "[json]": { "editor.defaultFormatter": "biomejs.biome" },
        "[jsonc]": { "editor.defaultFormatter": "biomejs.biome" },
        "[graphql]": { "editor.defaultFormatter": "biomejs.biome" },
        "[css]": { "editor.defaultFormatter": "biomejs.biome" },
        "[scss]": { "editor.defaultFormatter": "biomejs.biome" },
        "[html]": { "editor.defaultFormatter": "biomejs.biome" },
        "[markdown]": { "editor.defaultFormatter": "biomejs.biome" }
      }
    }
  ]
}
